<?xml version="1.0" ?>

<shiny
  xmlns="http://xml.spoonguard.org/shiny"
  xmlns:xsi="http://www.w3.org/2001/XMLSchema-instance"
  xsi:schemaLocation="http://xml.spoonguard.org/shiny/shiny.xsd">

<update id="update">
  <tuple id="tuple">
    <elt>updated</elt>
    <elt>David Brown</elt>
    <elt>Administrators, Plebians</elt>
    <elt>1/1/1982 5:44am</elt>
    <elt>1/1/2100 12:00am</elt>
  </tuple>
</update>

</shiny>

